{
  "$schema": "https://json-schema.org/draft/2020-12/schema",
  "$id": "https://auditspec.dev/schema/0.1/corroboration-report.schema.json",
  "title": "AuditSpec Runtime Corroboration Report v0.1",
  "type": "object",
  "additionalProperties": false,
  "required": ["report_version", "assessment_subject", "generated_at", "observation_scope", "matches", "unmatched_evidence_ids", "summary"],
  "properties": {
    "report_version": { "const": "0.1" },
    "assessment_subject": {
      "type": "object",
      "additionalProperties": false,
      "required": ["kind", "path"],
      "properties": {
        "kind": { "type": "string", "minLength": 1 },
        "path": { "type": "string", "minLength": 1 },
        "revision": { "type": "string", "minLength": 1 }
      }
    },
    "generated_at": { "type": "string", "format": "date-time" },
    "observation_scope": { "$ref": "#/$defs/observation_scope" },
    "matches": {
      "type": "array",
      "items": { "$ref": "#/$defs/match" }
    },
    "unmatched_evidence_ids": {
      "type": "array",
      "items": { "type": "string", "minLength": 1 },
      "uniqueItems": true
    },
    "summary": {
      "type": "object",
      "additionalProperties": false,
      "required": ["evidence_records", "matched", "supports", "contradicts", "inconclusive", "unmatched"],
      "properties": {
        "evidence_records": { "type": "integer", "minimum": 0 },
        "matched": { "type": "integer", "minimum": 0 },
        "supports": { "type": "integer", "minimum": 0 },
        "contradicts": { "type": "integer", "minimum": 0 },
        "inconclusive": { "type": "integer", "minimum": 0 },
        "unmatched": { "type": "integer", "minimum": 0 }
      }
    },
    "limitations": {
      "type": "array",
      "items": { "type": "string", "minLength": 1 }
    }
  },
  "$defs": {
    "producer": {
      "type": "object",
      "additionalProperties": false,
      "required": ["name", "type"],
      "properties": {
        "name": { "type": "string", "minLength": 1 },
        "type": {
          "type": "string",
          "enum": ["application", "database", "collector", "proxy", "kernel", "agent", "external"]
        },
        "version": { "type": "string", "minLength": 1 },
        "instance": { "type": "string", "minLength": 1 }
      }
    },
    "observation_scope": {
      "type": "object",
      "additionalProperties": false,
      "required": ["scope_version", "basis"],
      "properties": {
        "scope_version": { "const": "0.1" },
        "basis": { "type": "string", "enum": ["declared", "partial", "unknown"] },
        "environment": { "type": "string", "minLength": 1 },
        "window": {
          "type": "object",
          "additionalProperties": false,
          "required": ["start", "end"],
          "properties": {
            "start": { "type": "string", "format": "date-time" },
            "end": { "type": "string", "format": "date-time" }
          }
        },
        "collection_policy": {
          "type": "object",
          "additionalProperties": false,
          "required": ["id", "mode"],
          "properties": {
            "id": { "type": "string", "minLength": 1 },
            "version": { "type": "string", "minLength": 1 },
            "mode": { "type": "string", "enum": ["continuous", "sampled", "triggered", "manual", "unknown"] }
          }
        },
        "producers": {
          "type": "array",
          "minItems": 1,
          "items": { "$ref": "#/$defs/producer" }
        },
        "assumptions": {
          "type": "array",
          "items": { "type": "string", "minLength": 1 }
        }
      },
      "allOf": [
        {
          "if": {
            "properties": { "basis": { "const": "declared" } },
            "required": ["basis"]
          },
          "then": {
            "required": ["environment", "window", "collection_policy", "producers"]
          }
        }
      ]
    },
    "match": {
      "type": "object",
      "additionalProperties": false,
      "required": [
        "evidence_id",
        "evidence_kind",
        "producer",
        "observed_at",
        "relation",
        "trust",
        "coverage",
        "rationale"
      ],
      "properties": {
        "evidence_id": { "type": "string", "minLength": 1 },
        "evidence_kind": {
          "type": "string",
          "enum": [
            "application_execution",
            "authorization_decision",
            "transaction_commit",
            "audit_persist",
            "outbox_persist",
            "delivery_receipt",
            "trace_span",
            "database_observation",
            "kernel_observation"
          ]
        },
        "producer": { "$ref": "#/$defs/producer" },
        "observed_at": { "type": "string", "format": "date-time" },
        "boundary_fingerprint": { "type": "string", "minLength": 1 },
        "finding_fingerprint": { "type": "string", "minLength": 1 },
        "relation": {
          "type": "string",
          "enum": ["supports", "contradicts", "inconclusive"]
        },
        "trust": {
          "type": "string",
          "enum": ["authoritative", "attributed", "self_reported", "derived"]
        },
        "coverage": {
          "type": "string",
          "enum": ["point", "sampled", "window", "exhaustive"]
        },
        "rationale": { "type": "string", "minLength": 1 }
      },
      "anyOf": [
        { "required": ["boundary_fingerprint"] },
        { "required": ["finding_fingerprint"] }
      ]
    }
  }
}
